{
  "format": "test-parrot/exam",
  "formatVersion": "0.3.0",
  "name": "Unit 3 Quiz",
  "sections": [
    {
      "type": "multiple-choice",
      "title": "Warm-up",
      "instructions": "Circle the best answer."
    },
    {
      "type": "short-answer",
      "instructions": ""
    },
    {
      "type": "multiple-choice",
      "title": "Challenge"
    },
    {
      "type": "matching"
    }
  ],
  "headingSize": "large",
  "textSize": "small",
  "header": {
    "first": "Student: ____________  Period: ____"
  },
  "positions": [
    {
      "question": {
        "bank": "bank",
        "question": "q1"
      },
      "section": 0,
      "columns": 2
    },
    {
      "question": {
        "bank": "bank",
        "question": "q5"
      },
      "section": 1
    },
    {
      "question": {
        "bank": "bank",
        "question": "q2"
      },
      "section": 2,
      "columns": 1
    }
  ]
}
